,polarity,summary,reviewText,year,uuid,asin,reviewerID
431,negative,Diaper Genie = Your nursery will smell like a sewage plant,"We HAD a Diaper Genie, it's a total waste of money and plastic. The Diaper Genie was so hard to use and didn't do anything to stop odors. My son's room smelled as if we threw the dirty diapers in an open garbage. And the fact that you have to buy their ""special bags"" added insult to injury.We replaced it with THE FIRST YEARS CLEAN AIR DIAPER DISPOSAL SYSTEM. It's so much more effective and easy to use than the Diaper Genie, and you use your own tall kitchen garbage bags.The greatest thing about The First Years Clean Air Systen is that it can store about 6-7 days of my son's diapers without NO yucky odors. WOW!! We love this product so much. Our son's room smells clean with no poopy odors, and we save money by using our own tall kitchen bags. It's also very easy to change--no confusing bag twisting.STAY AWAY FROM THE DIAPER GENIE. You'll just end up having to replace it because your baby's room will stink terribly.",2007,1174089600B0001NE8OAA1MAI0TUIM3R2X,B0001NE8OA,A1MAI0TUIM3R2X
432,positive,I Love to See His Smilely Face!,"I really love having the mirror!  We didn't get it until my son was 6 months or so, but I'm getting my money's worth now.  I don't know about the projectile thing... ours secured to the tether at the top of the headrest, but if we get into that bad of a crash, I'm sure window glass, or something, would be more of a hazard...  I recommend it.",2006,1143244800B0000E3D8LA19OGW5YP7JSSG,B0000E3D8L,A19OGW5YP7JSSG
433,positive,Perfect especially for the price!,"I couldn't see spending a ton of money on a carried being my son was growing super quick. So, I splurged and bought this carrier. I was so pleased with it, I bought another one to keep in my Mother-In-law's car so I always had it handy. It was cheap enough that I could actually do that! I never wore it on my back. I want even aware that you could, but I loved being able to see my angel and hug him all the time. Both my husband who is a foot taller then I and myself both enjoyed using this and it worked great. My son loved being in it as well. I wish it went higher up on the weight though since my son grew so rapidly.",2005,1123804800B0002XO5M4A1ZTZLCU222JPC,B0002XO5M4,A1ZTZLCU222JPC
434,positive,A little expensive but worth the price,"I thought this mobile was very entertaining to my boy..it was a little expensive but worth the price. After he was old enough to pull it that they say to not have mobiles anymore, I took the whole toy apart and we played with all it's pieces and the music box separately for many months.",2009,1235174400B00067ELGGA2JW331ATA1PP2,B00067ELGG,A2JW331ATA1PP2
435,positive,One minor flaw,"This is a great seat for the money. Honestly, I don't see the point in buying a more expensive one. HOWEVER: when the music/vibration unit at the bottom of the seat is removed, the metal rack it attaches to sticks out, right in the path of my son's little feet. He hits his heels on it all the time (we removed it since he we never really used it). He has since trained himself to not put his feet near it (he got little bruises on his heels), and other than that he loves this seat. We even broke it down and took it with us on vacation. The fabric in the seat is very easy to wash and the colors haven't faded at all. Great seat, with one minor flaw.",2009,1243123200B001134IL2A1YXKR8FJDKOQC,B001134IL2,A1YXKR8FJDKOQC
436,positive,best idea ever!,I love these snack cups! we have a dog who is always hounding my daughter for her snacks. with these cups she can drop it and they dog doesn't get all the contents!,2006,1140566400B0009FIMPGA1O9TQSCKSLG9J,B0009FIMPG,A1O9TQSCKSLG9J
437,negative,Hard to put together and very leaky.,"I was very excited to get my son this cup to drink out of. I thought it would keep his drinks cold in the summer and be easy for him to use.I am very disappointed.  The cup's parts do pull apart for easy cleaning but the spout is very hard to get back into the lid and almost impossible to line up exactly right.  I am not sure if it is because of this that the cup leaks.  After messing around with the lid for a good 10 minutes and thinking that it was on good; the cup *still* leaked.I am not talking about leaking from my 15 month old throwing the cup around either.  We had this cup sitting in the cup holder in his stroller and 5 minutes of movement from the stroller (at the zoo) caused it to leak out a puddle of milk into the cup holder.  We ended up having to throw out the remainder of the milk and beg some napkins from a zoo snack stand attendant to sop up the mess.  I am really frustrated that this cup leaks with even normal (not toddler like) use.  The fact that ""leak-proof"" is in the title is really ironic...In summary:Pros- Keeps things cold- Easy to cleanCons- Hard to pop the spout back in- Leaks very easy (we are talking that it leaks while sitting in the stroller.)- Really, really leaks!",2008,1211846400B000O3PFVWA22B13EJTZKCTM,B000O3PFVW,A22B13EJTZKCTM
438,positive,its a OK tub...,My Sister used this tub when she was in her apartment.. they bearly used it... its gently used and well they liked it in there apartment but he out grew it to quicky! its a good buy if you have a small house/apartment!! we liked it for the first few time he got a bath...once he out grew the tub he was placed in the big boy bath tub and he loves it!! and he loves to splash water every where and there's no one to keep him in this toddler tub its a great buy... and we loved it at the beginning of  his bath times!!,2006,1149033600B000067EH7A3DTM08XWOZGYB,B000067EH7,A3DTM08XWOZGYB
439,positive,great crib,"great crib, easy to assemble (it was pretty much assembled when it arrived!) My 6 month old son who is almost 20 pounds fits well in it, but I had to double wrap a bumper pad around it so he wouldn't roll into the cold metal! I am not sure how long he will fit into it, but I love its portability and how I feel there is no rush to move my happy 2 yr old out of his crib. And its overall best feature is how you can roll it from room to room without taking it apart.",2005,1128902400B000056HNDA3JP5LWNMVTU3Y,B000056HND,A3JP5LWNMVTU3Y
440,positive,Great Teether!!!,"This is a GREAT product.  My son plays with it all the time, and chews on it when he gets the urge.  I was a little surprised at it's size (a bit smaller than expected) but when I realized my little one could hold it with one hand (or two) and hold onto furniture to walk with the other, I couldn't have been more pleased!  It's definitely NOT too small, it's the perfect size for a toddlers small hands.",2008,1228435200B000VLR178A1RBZ301PZLBVT,B000VLR178,A1RBZ301PZLBVT
441,positive,Best Chair!,I love this chair. It is so easy to use and the tray slides easily with one hand. (A big bonus when dealing with a wiggling baby.) It is easy to clean and I like how well the chair pad has come through the wash. Highly recommended!,2005,1121990400B0001NE3ZOA2HHAV29CZ1OIE,B0001NE3ZO,A2HHAV29CZ1OIE
442,negative,Nice but not for us,"I was looking for an easier baby sling (currently use the Moby) and thought this would be a good option.  The material is nice and light, excellent quality, and the baby blue with navy stitching is a lovely color.However, it just doesn't match up to the Moby.  I never felt like my baby was truely secure in his spot while in the Ktan.  Though the Moby takes a bit of trial and error to get the wrapping down pat, it has a pannel you can pull over the baby which secures everything in place.  The Ktan is missing this last piece.  You also have to buy the correct size so if you and your partner are different sizes, you have to buy two.  The Moby is one long peice of fabric that both my husband and I can use so we only have to carry one sling with us when we're out and can EASILY switch it back and forth between us.",2009,1245628800B000UXQFVUA1MFARTPOQ9XXJ,B000UXQFVU,A1MFARTPOQ9XXJ
443,positive,Great heavy weight sleep sack,"We have several of these in various sizes and fabrics.  They are all terrific.  We're using the fleece at night in the winter, the quilt during the day in winter and we used the cotton one in the Fall.  I highly recommend this line of wearable blankets!",2006,1136592000B000069EXNAFA4Q7IF5DIT,B000069EXN,AFA4Q7IF5DIT
444,negative,There are probably better products...,"Be wary of any diaper pail that requires instructions and a demo by your next-door-neighbor in order to use it!  After I figured it all out I found that it was a pain to fool with.  Also the refills are expensive and it doesn't hold enough diapers IMO. It doesn't lock out odors either.  It may have for the first week or two, but now at 3 1/2 months it SMELLS BAD.  I guess the diapers have gotten stinkier.  What can I say?The other thing that drives me nuts is that the first few diapers I put in after a refill change never go in correctly.  No matter how many times I twist after the first diaper, the second one always pushes right through the first twist and ends up hanging in the bottom - un-sausage-linked.  The only positive thing I can say is that when you do cut the links loose they are easy to dispose of in the outside garbage.You may want to save your money on this one and go with something less fru-fru.",2002,1023840000B000056OV3A2V350Z799DUA8,B000056OV3,A2V350Z799DUA8
445,positive,Thank god for inventions like this!,"I read someone elses review that says ""couldn't have taken a shower without it"", all I have to say to that is, hallelujah! Everyday for months I put this thing in the bathroom in front of our wall mirror, my son loved it. Between playing with all the toys and smiling/talking to himslef in the mirror, I could once again take a shower that lastest more than 2 minute, and even put on some make-up and brush my hair!And just like the other mom said, put them in this with the Baby Einstein on and you've got yourself one life saving baby cocktail! My son loves it and I couldn't get very much done without it! Although now that he's 8 months and very mobile, he doesn't like it so much anymore, he'd rather be free to chase the dogs and throw the dvd's all over the house. =)",2006,1139788800B000BKTEYCA1PLZ81RMAR8GW,B000BKTEYC,A1PLZ81RMAR8GW
446,negative,"Not a Miracle, Seems Unsafe","Yes, yes, I read Karp's Happiest Baby on the Block, and yes, I believe that swaddling itself is the miracle-not this blanket.  I had a few swaddlers from First YearsThe First Years Easy-Wrap Swaddler - Yellow (much cheaper and worked better), but my son outgrew them.  So, I decided to try the Miracle Blanket.  I wish I hadn't spent the money.  First, the price is very high.  Second, it's a long blanket that wraps--there are no closures (velcro, snaps, etc), so he tends to slip down into the blanket, and the arm flaps bunch up in his armpits (uncomfortable).  What's worse, the blanket unravels and wraps around his neck.  Scary!  He gets very hot in this blanket (despite central A/C and ceiling fan--his back and neck are drenched!), and overheating is another risk factor for SIDS.  Oh, and forget about ""quick"" middle-of-the-night diaper changes--it's nearly impossible to get his legs out of the bottom pouch, so wrestling him out of the blanket wakes him up.  Overall, I would not recommend this blanket.",2009,1254355200B000G0J5FUA25EKKRY8C3QBK,B000G0J5FU,A25EKKRY8C3QBK
447,negative,Not worth it,"These locks did not install quickly, my husband had a difficult time aligning the separate pieces in a way that allowed the magnets to operate properly. One of the drawers won't close unless I press hard on the direct spot where the lock is located. Another issue is the magnet 'key' which I wouldn't have known to order had I not read it in a previous review. If you don't order the four pack of locks you must order the key separately! Overall, a lot of fuss and we end up leaving them unlocked because they are a nuisance.",2009,1238457600B000GE6W2KA3Q6QS8NK7TOES,B000GE6W2K,A3Q6QS8NK7TOES
448,positive,Great idea.  We love it.,"I bought this for my son a couple of years ago.  We used it lots when we were out, especially when he was potty training and just couldn't wait.  It's wonderful.  Just wish it was easier to find the liners.Another reviewer said there are sharp edges.  Ours doesn't have any sharp edges.  It does collapse, if the legs aren't snapped up properly; but otherwise isn't a problem.Our daughter is potty training right now and we have it ready for her whenever she needs it.  It will also be great for our upcoming car trip.UPDATE:My daughter is now 5 years old.  We've had this for so many years and it's saved us many times.  We still have this in the back of the car for those rare emergencies.  What a wonderful buy.",2007,1172880000B00069BV8AA22CW0ZHY3NJH8,B00069BV8A,A22CW0ZHY3NJH8
449,positive,If you sleep in the same level of the house. DONT,"This monitor is excellent!  we have little interferance with other equipment (my hubby is a geek and we have it all! wireless router, phones, tvs, etc) the sound is good and there is not much noise.  BUt having our girl in the next door room does not justify having the monitor.  So, unless your house is HUGE, or you sleep in the second floor while the baby is in the first one (or backwards) use your money in diapers!",2005,1126656000B000S35QLCA196POQVTSKYN5,B000S35QLC,A196POQVTSKYN5
450,positive,Really gives their leg muscles a work out!,"This is a great item to help your child strengthen their legs, plus the added bonus of wearing them out before nap time!  The look of joy on their little faces, once they figure out how to jump, is the greatest thing ever!",2007,1196553600B000BXC1AIA1O1BSSV5XCOHW,B000BXC1AI,A1O1BSSV5XCOHW
451,positive,Do yourself a favor & get this early!,"Just get one of these (actually, I got two so I wouldn't have to keep moving it around so much.) At 2 months, our baby's head was getting awfully flat. Enough so that the pediatrician scheduled an appt at 3 months to look at it & possibly talk about ""the helmet."" I freaked & ran to our local BRU that same day. I used it in the swing, the activity rocker, the bouncer & in her stroller, but not her car seat. I also let her (danger danger!!) sleep on it at occassional naps. If I was sitting in my bed reading, I'd lay her next to me on her noggin nest for a nap. (Nothing dangerous there.) I wouldn't let her sleep on it at night, or anytime she wouldn't be constantly supervised. At any rate, by 3 months, the doctor said she had improved immensely, we'd just keep an eye on it. We kept using it & at 4 months, he said we didn't even need to worry about it anymore. I used it for a few more weeks after that, until she started turning her head a lot more at night & started sitting up. Now I only use it in her activity rocker as a pillow because she likes. She's 5 1/2 months now and has a beautiful round head! I can not recommend this highly enough!",2005,1128297600B00009K2YUA2MYRQNZM3YVX2,B00009K2YU,A2MYRQNZM3YVX2
452,positive,Holds a week's worth of size 3 diapers and never smells!,"This is an excellent diaper pail!  It looks and works like a regular trash can - just step on the foot pedal and drop the diaper in.  No twisting or other fancy maneuvers necessary.  The refills are very simple to replace and when it's time to empty the pail, all you do is cut the bag, tie a knot and you're done!  Although it is small, it holds a ton of diapers -- so far we only have to empty it about once a week.  The refills are a little pricey, but a 3-pack lasts several months.  You definitely want this one on your registry!!",2006,1150761600B00005V6C8A215LLZ0BLO4JK,B00005V6C8,A215LLZ0BLO4JK
453,positive,Better than a nanny!!,"LOVE this for our little girl.  She enjoys bouncing around and loves that she can turn all the way around in the chair to play with all the toys but also to face Mommy and Daddy when they walk to a different part of the room or into the kitchen.  I work from home and this has been wonderful for entertaining her while I'm working.  Great purchase, easy to assemble, worth every penny.",2009,1260057600B000LXQVA4A3FU7ULSBD1V97,B000LXQVA4,A3FU7ULSBD1V97
454,positive,Another A+++product from Kiddopotamus,"We love Kiddopotamus products and this one is no exception. We don't use this anymore because my daughter is a toddler but we used it since the day my daughter was born and we brought her home from the hospital. No slouching, very comfy and cozy - a definite must buy for any baby shower. (In fact I've bought quite a few for friends having babies.) AWESOME. Yeah Kiddopotamus!!",2005,1113782400B00005BT37A1DJQZITT2YEH5,B00005BT37,A1DJQZITT2YEH5
455,positive,5 month old LOVES it!,"My 5 1/2 month old loves this new toy. Oslo, the dog is her new favorite chew thing. She likes pulling apart the panels of the box. She likes chewing the flaps and looking in the mirror. I can fit in a few more of her favorite soft rattles and pack the box in her diaper bag for trips out. She can be entertained indefinitely with this.",2008,1216080000B000GK22R8A1FCUWDW0BKOIT,B000GK22R8,A1FCUWDW0BKOIT
456,positive,excellent tub,"the best feature is the sling. it holds a newborn perfectly. my baby likes to hang one foot off the side and dip it in the warm water. there is a place that holds shampoo/baby wash. i'll be using this when my baby is a toddler too. another great feature is it has a groove in the back, where you can use it in a sink, or lean it against something to dry. it has a drain too. i don't use that though, because i put the tub on the floor. it's the best tub, and very affordable!",2004,1076371200B000067EH7A15BT7GWK4AAMD,B000067EH7,A15BT7GWK4AAMD
457,positive,Keeps His Tushy Warm!,"We received this as a gift and love it! It warms the wipes nicely. When we use unwarmed wipes my baby gets more upset at changes. Perhaps we are spoiling him. ;-) He is a winter baby so I'm sure he appreicates our efforts to keep his tushy warm.The only time I have had problems with wipes drying out is when I have over filled it and the lid doesn't close tightly or I have accidently left it open. When that happens, I have just added a bit of water and it restores them nicely. I found that the bottom wipe does turn brown but only when I keep adding the fresh wipes to the top and the bottom ones were older. Now I remove the whole remaining stack and add new ones to the bottom. Even if they are slightly brown, it just looks weird. I'm pretty sure the wipes are just fine.I do wish that it came with a pop-up adapter or something. I like the Pamper's pop-up wipes but find it difficult to pull one out because they are inner-folded and stick together. It works better with the Huggies wipes.The only other issue is that the lid collects condensed water and I am afraid of it leaving a puddle on our furniture. So, I place it on a folded face towel and that seems to work.Overall despite the few minor issues mentioned I am very pleased with this product.",2005,1104624000B00005QBWZA1EXDO435S1N1E,B00005QBWZ,A1EXDO435S1N1E
458,positive,Her First Smile,"A relative purchased the Baby Einstein Play Gym for my daughter when she was one month old.  Being a sleep-deprived first time mother, I was not sure she would even need such an item.  Two weeks after receiving the gym I opened it, put batteries in the musical star, and arranged all the  toys on the bar according to the directions.I placed my daughter on the colorful mat with her feet on the bar.  She sat there for a moment, kicked the bar, activing the musical star.  Then, in a moment I will remember for the rest of my life, she smiled for the first time.It did not take her long to figure out that kicking the bar would make the star play a song for her.  She loved this toy for many months (until she learned to crawl).This is a wonderful toy for young babies.  Some of the toys rattle, and the bright primary colors easily attract a baby's attention.  My daughter especially enjoyed looking at the ladybug.  The star is detatachable and made many trips to Grandma's house with us to place in her pack and play.  I washed the mat in the washing machine and dried it on gentle many time without any problems.I hope this information is helpful to anyone deciding which play gym to chose for thier baby.  You can purchase this item without any fear of buyer's remorse.",2007,1186876800B0000936LRAMDDPJASEYDBF,B0000936LR,AMDDPJASEYDBF
459,positive,"Gorgeous designs, wonderful quality, stands up to a lot of spitup and washing","We love the 50s style designs, and these are very very soft for catching and wiping up spitup, and they stand up to heavy duty washing.",2008,1212796800B000SEPNPAA1WF68T1KI3AW7,B000SEPNPA,A1WF68T1KI3AW7
460,positive,Easy to use and works.,"This adapter and plug cover works very well.  We had this in my son's room from when he was a toddler to cover an monitor adapter that would have been easily accessible to him.  He was very curious about plugs and outlets, but he never got into this cover.It's easily installed and it gives adults easy access to the adapter.  The size adjusts lengthwise and is large enough to fit the majority of adaptors.  As with all childproof products, don't let your kids see how it's done.",2009,1233273600B003YVHXAWA22CW0ZHY3NJH8,B003YVHXAW,A22CW0ZHY3NJH8
461,positive,Baby and I love the Bjorn,"This was the most useful gift we received for our baby. At a very young age, my son has exhibited the strong need to explore and see different things. Since he can't crawl yet, it's imperative that he be carried around so he'll be entertained. Enter the Bjorn, a must have in my book.Pros: Easy to use, easy to clean, offers great support for baby's back and neck. Some reviews noted it offers little or no back support for the person carrying the baby. Our little one is over 20 lbs now and I still use this more than our jogger when hiking. My shoulders feel sore, but my back felt good with some minor adjustment on the lumbar support.Con: I wished the front panel was expandable. My baby is a bit, uhm, round in the middle, and on times when it's cold outside and he has a sweater on, the front panel becomes harder to hook in.",2007,1198886400B0009JOSNCAGXSFDTK4DH9X,B0009JOSNC,AGXSFDTK4DH9X
462,positive,"Easy to use, fits both Graco car seats we've had","This is a great addition to our already wonderful Uppababy stroller.  When our little one falls asleep in the car, it's easy to snap into the stroller, click her car seat on and go.  It clicks on tightly and holds the car seat firmly in place.  It's light weight and super easy to attach.  Great purchase, highly recommend it as an addition to your Uppababy stroller.",2009,1260057600B000VLY3QKA3FU7ULSBD1V97,B000VLY3QK,A3FU7ULSBD1V97
463,positive,Great Bottles.,"I bought these bottles after reading reviews on them and have been pretty happy with them. They have never leaked with me BUT I have never screwed the lid on too tightly. You HAVE to remember that. When you overtighten the lid, the nipple gets distorted and the seal is broken. My husband and others in the family have had this problem. It is probably always helpful to test for leaks (when you test the temp of the milk) BEFORE you give it to the baby, just to make sure.I like the plastic they use. It has always felt extremely sturdy. They are easily to hold (thanks to the curve) and I really like the wide mouth of the bottles which make them easy to clean....and you are pretty sure they are clean!!I bought the newborn starter set and the infant set and together they are all I require for bottles and a breastmilk storage set!! I really like dthat you get the brush, pacifier and two sizes of bottle in the newborn set. Made my life easy.All in all I think they were a great buy and worth it. I would use them all over again and would use avent with my next baby too.",2005,1120089600B0000AY9XYA31F1G0S4GXAKY,B0000AY9XY,A31F1G0S4GXAKY
464,negative,User Error?,We couldn't get the sheet on right.  It kept lifting the corners of the floor mat.  They weren't soft like the others either.  We never used them... You can find ours at Goodwill.  Waste of money.,2006,1143244800B000056JHXA19OGW5YP7JSSG,B000056JHX,A19OGW5YP7JSSG
465,negative,"LEAKS and DOESN""T HELP w/ SPIT-UP, SAVE YOUR MONEY","I bought these bottles for my baby who is a big spitter.  They haven't helped at all, and one of them leaks like crazy all over the place.  I will be calling Playtex to request a refund.",2005,1132012800B00005BTNAA24ZVNHFYQPLAL,B00005BTNA,A24ZVNHFYQPLAL
466,positive,"practical for on the go, not for daily life","These bottles are lightweight so they are perfect for travel.Perhaps the bottles don't need to be perfectly sterile for the baby, but I'm still hesitant to approach these as completely sterilized. They bottles are sterile in the pack they come in, but once you open them, then what?The fact that they are recyclable is a bonus, but these bottles are incredibly pricey ($1/bottle) to be used daily at every feeding.",2009,1260662400B002QUYZUIA319Y83RT0MRVR,B002QUYZUI,A319Y83RT0MRVR
467,positive,Love it!,I bought this seat when I was pregnant with my second child because I couln't pick up my toddler anymore and because I wanted him to be seated while eating. I used to put it on the floor an he liked it right away. Now I am attaching it to a chair and he loves it either way. I don't know what I would've done with out it!,2008,1203292800B0000DEW8NA3E9SOQG8XUU43,B0000DEW8N,A3E9SOQG8XUU43
