,polarity,summary,reviewText,year,uuid,asin,reviewerID
261,positive,"Great potty, especially for boys!","I had a Safety 1st potty that I just hated before I bought this Baby Bjorn potty.  It leaked, its round opening was WAY too small, and I had a ton of problems with my son leaking all over the front and on to the floor.  Plus it came apart in many pieces and had lots of spots bacteria could hide.  The Baby Bjorn takes care of all the problems I had with the Safety 1st potty!The simple construction is so sanitary and easy to clean.  There are no little places for bacteria to collect.The opening is bigger than other potty chairs and oblong instead of round, so no more pooping on the seat.  This alone would have sold me on this potty.The splash guard is great for boys.  No more peeing off the front of the potty and no flimsy detachable splash guards that flip down into the seat.It has a nice rubber grip on the bottom to keep it in the same place on the floor.Another plus is that it's nice looking and blends in with the rest of the bathroom.I'm very happy with the quality and design of this potty and I have NO complaints!",2005,1122422400B000056J7KA3GJ0RDALQQT5G,B000056J7K,A3GJ0RDALQQT5G
262,positive,safe and nice looking,"I love this co-sleeper because I have a one-bedroom apartment and I prefer bedsharing to a crib.  The co-sleeper is great for my daughter to sleep or rest in.  She's always close by because I can wheel it around the apartment.  and it has tons of storage, which is also a huge help.  It's extremely portable and fits into a small bag.  It's easy to assemble and take apart.  And it has excellent safety features.  I'm going to keep this stored in the closet to use with any more new babies we have.",2009,1253318400B000HKY1GMA1YHI49AWYNI34,B000HKY1GM,A1YHI49AWYNI34
263,positive,You have to have this,I wish i would have brought this to the hospital with me when i was struggling to the point of tears with nursing. Now at 11 weeks old I use the Boppy to nurse everyday and night. I use it so much I had to buy a second one to use upstairs in the middle of the night. The covers and pillows are washable although I haven't washed the pillow yet i have washed the covers several times and they are holding up great. I use this to nurse and to play because it is great to put the boppy by my knees and then the baby can see my face and it is easy to get her to smile using the boppy for support.,2005,1122595200B000231GEOA2D6B8N0CTJ28L,B000231GEO,A2D6B8N0CTJ28L
264,positive,It was fun while it lasted,"We got this water mat when my twins were very small - 3 months maybe?  We would prop them up in bobby pillows and put the mat in between them and they liked leaning over to feel the mat.  The ""fish"" (toys) inside did not move as much as I thought - maybe we didn't have it filled up right?Then, once they were sitting up on their own, we would sit them on the mat...we said they were sitting in their pool..and they enjoyed that.  Eventually, one of them punctured it and we didn't try to put a patch on it.We use the floating toys in the bath tub now ;)",2009,1245801600B000E82WRMA2QANOGP5LLPBQ,B000E82WRM,A2QANOGP5LLPBQ
265,positive,Good Price but..............,"I bought this as 2nd stroller, to park and short errand for my 4 months baby.Cons:Light weightGood canopy size5 point harnessRecline (thoug not alot but is comfortable for my 4 months old)Durable madeEasily clean seat fabricDoes not tip over when my diaper bag and shopping bags hand over the handle!ProsSmall and uselss basket.. impossible to put anything in it or accesswish it will recline moreLonger handle ( I am 5 2 and on off i kick the back of the wheels. NOT for tall parents! )OverviewOverall I am happy with my purchase.. and YES i would recommend to anyone if they have shorter legs!",2009,1255564800B000FFS9VMA2661SA1L2OEL6,B000FFS9VM,A2661SA1L2OEL6
266,positive,Excellent!,"We bought this primarily because it had better reviews than the Diaper Genie when we bought it and that we don't have to buy special bags. I love that you can use trash bags. I haven't had a problem with the bag not being full enough. For one, when the Champ is full the trash bag is a bit more then half full, but is also very heavy so you wouldn't want anymore diapers in there anyway. The only problem I've found with it was when my sister-in-law put my 2 year old nieces diaper in there and the smell lingered a bit. Her diapers are MUCH different then my 3 month old son though. So overall I love the Diaper Champ!",2005,1135814400B00003TL7PA19EF05WDNULJS,B00003TL7P,A19EF05WDNULJS
267,negative,Love the features but this bag is not good at all,"I used my backpack like for 5 months and the seams by the zipper falling apart after like 40 uses. It never happened to me ever in my entire life though I'm complete ""backpack person"" and I never had anything else but a backpack.. Next time I will rather go than for a special backpack for normal backpack with all life warranty and buy changing pad for it.",2007,1184198400B00029P388A38TI9JNGGW0YW,B00029P388,A38TI9JNGGW0YW
268,negative,Way too slow for even a (full term) breastfed baby,My daughter is a vigorous nurser and we supplement with expressed breast milk while I am at work.  She cannot draw the milk in from these nipples and if she is hungry enough to do the extra work it takes about 40 minutes to eat 4 oz. Not worth it.,2008,1226707200B0010SD8VEA3KS9JXWUI3L6X,B0010SD8VE,A3KS9JXWUI3L6X
269,positive,Sanity saver for us,At 2 months old our little guy was so fussy and we had tried 3 different formulas and almost every bottle. Finally we tried Dr. Brown's and literally overnight our cranky little man turned into a sweet baby who slept normally and cried only when hungry or tired or poopy. Before he cried all the time and we never knew why...and I thought we just had to wait it out until he was four months and they say fussy babies mellow.These bottles are not that hard to clean and worth the extra little effort it does take since it obviously helps with gas. The liquid flows so easily and the baby does not have to suck so hard- I highly recommend even if you don't have a fussy baby because they seem to work the way a bottle should.,2008,1215648000B00078ANK2A2FK6QTW5MU07B,B00078ANK2,A2FK6QTW5MU07B
270,positive,Best thing since sliced bread,"This sterilizer is so easy to use even a dad like me can use it.  The tray holds all types of bottles, caps, etc.  Best of all, the bottles are clean and sterilized in four minutes, without boiling water or running a half-full dishwasher.I know, the price seems high, but this is one luxury that is truly a necessity.",2001,995846400B000056OUHAQCHVXD1R9WYI,B000056OUH,AQCHVXD1R9WYI
271,positive,Terrific set,"I received this set as a gift.  I do agree with one of the reviewers you get some of the items in the hospital, however, we didn't get all of the items and when you're a new parent pressed for time, it's awfully convenient to have everything you need packed into one kit.The one ""add on"" that we put into the kit ourselves was a digital ear thermometer.  Other than that, it had everything we needed.It's great for travel, and the items are well made and attractive in appearance.  It would make a terrific gift.",2005,1111017600B00005UC6DA3HSQD4KEAC60O,B00005UC6D,A3HSQD4KEAC60O
272,positive,PERFECT FOR ANY NEW MOM!,"I LOVE my Boppy!  Everyone asked me, what's a Boppy. I figured it was just for feeding. Boy was I wrong. I breast feed my daughter, so I used it right away in the hospital. I also used it while in the hospital around my belly as an arm rest, since my tummy didn't work well as one any more. When I got home I found laying her in it was perfect, kept her upright so I didn't have to worry about her choking on her milk after feeding, since she has acid reflux the doctor suggested keeping her upright for at least 5 minutes after feedings... I have taken many good pictures of my little one as a baby, held her perfect. Now that she is learning to sit up, its a perfect helper.. I would definetly recomend this to any new parent!",2004,1074902400B000067BIZA3POXMCWJD594,B000067BIZ,A3POXMCWJD594
273,positive,So much better than a pacifier,"My baby doesn't like pacifiers at all so I was skeptical about this. I was wrong, she loves it. It really helps her with teething because she loves to chew on it. Highly recommend it.",2007,1195516800B000JWSO9IA3VD1P53RES7Z,B000JWSO9I,A3VD1P53RES7Z
274,positive,fits well,Haven't had any accidents to report on the function.  The fit is great and texture is great too.,2009,1256688000B001FCK32CA1F0809QT61J2D,B001FCK32C,A1F0809QT61J2D
275,positive,Generally a really good product,"For the most part I am very pleased with this product. It cut down on the gas problems my daughter had and really I had no trouble cleaning them. There was one bottle that for whatever reason leaked when I shook the bottle to mix it. Seeing that it was only one bottle out of the 6 that we have, I am not too bothered by it. Ultimately it's a fine product and I would recommend it.",2006,1137369600B00005BTNAA1XZJ29KK7O78S,B00005BTNA,A1XZJ29KK7O78S
276,positive,Soft sheets!,"These sheets are so soft, made of jersey fabric.  They are a little big for my cosco play yard, but they're overall good, especially for the price!",2007,1194480000B00030AZT8A1C4J5MRES1KRK,B00030AZT8,A1C4J5MRES1KRK
277,positive,A good buy,"No special bags to buy... change at least twice per week (especially in the summer) and you are good to go. Remember this thing contains poop, so if it is not changed often, it will smell.",2005,1122508800B00003TL7PA2HHX876PGDZL,B00003TL7P,A2HHX876PGDZL
278,negative,"Good, but battery makes it hard to wash","We have made liberal use of suction cup toys like this for our children. We understand that you need to make sure that the surface is clean and smooth and that the suction cup is fully rinsed before trying to stick it down each time. Even with those precautions, sometimes they stay down; sometimes they don't.I bought this toy because we had something similar that I bought 8 years ago for my first child. I really didn't want something with a light in it, but didn't have a choice. My 6 month old will put this in his mouth while he sits at the table with us and it generally gets covered with food or drool. He couldn't care less about the light, which is motion activated.There is a little hole in the light-up ball that allows water (and who knows what else?) inside. Washing it means having to keep your finger over the hole and hope that you can rinse it fast enough. If food gets inside that hole, you are out of luck.I can't figure out why anyone would make a suction cup toy (presumably for use at a high chair, around food) that cannot be easily washed.",2009,1260835200B001H9NXLGA1N7FWCVYOSCZ6,B001H9NXLG,A1N7FWCVYOSCZ6
279,positive,4days old,my 4 day old son loved this swing he slept in it for hours it was the best $165.00 i ever spent for my lil one and for my sanity.,2009,1251331200B000I5Q19QA3JZAPUZEV61TN,B000I5Q19Q,A3JZAPUZEV61TN
280,positive,Perfect size for travel snacks!,I love the size of these bowls!  They are great to put snacks in and toss in the diaper bag.  They are quality plastic and last a long time.  I am buying more because over time you loose a few here and a few there.  Great to have on hand if you have toddlers.,2008,1201564800B000JVXUF2ARS7MNRW8YNNH,B000JVXUF2,ARS7MNRW8YNNH
281,negative,Does nothing for odors,I bought this diaper because of the good reviews however I found that it does nothing to keep out odors.  I am going to purchase the odor disks I just saw on amazon.  Hopefully this will help.  My son's room is very small and once I open the diaper pail his whole room begins to smell and its not like the pail is filled with dirty diapers when this occurs.  I would only have 2-3 diapers in there when it begins to smell.  I wish I had gone with a more expensive diaper pail because I can't take the odor.  I hope this helps.,2009,1262044800B00083HK0MA6A0OINXRSV6F,B00083HK0M,A6A0OINXRSV6F
282,positive,Best bath tub!,Our son loves this bath tub! He is so relaxed in it! Best out there on the market!,2005,1130198400B000056OV0A12D7ROCUOZVP8,B000056OV0,A12D7ROCUOZVP8
283,positive,Great for a girl!,"I have a little girl and she started using this potty chair at a year old (early, but just to get the concept!)... she has loved it since day one!  She was entertained by the music which was a great incentive for her to stay a little longer on the potty, and when she was ready it transfers and snaps onto the &quot;big girl potty&quot; and still plays music!  She is now two and uses just the big potty but every now and then she still asks for this!  We didn't get much use out of the potty book that comes with it, but it's a cute idea.  All in all this was a good choice for us!",2004,1073865600B000067QMJAP2DUPMGNQP9T,B000067QMJ,AP2DUPMGNQP9T
284,positive,love it,"I bought this for my three month old son and we are really pleased with it. It's fun for him to learn to sit up and it offers a new vantage point for him. The toy is also very entertaining.I did not have a problem with the smell like others- there was a slight smell when I opened the item, but after washing it and airing out over night, I really didn't notice an odor.I would really recommend this to other parents.",2009,1249257600B00162ZLVEA20WZCDGVPLE7X,B00162ZLVE,A20WZCDGVPLE7X
285,positive,Best bath tub for infants and toddlers,"Our baby's umbilical cord stump fell of when she was just a few days old, so we bathed her in this tub.  She was too tiny for her arms to fit in the arm places, but it worked perfectly because she fit snugly and securely in the place that the body is supposed to go.  Baby won't slip under the water because of the plastic mouldings, so you can have both hands free to wash and reach. Once our baby was big enough to sit up, we put her on the other end (toddler end), and she plays and splashes, while still having the plastic molding so she can't slip back into the water.  She's 18 months old now and we fill the tub to the brim in the big bathtub.  This is a large baby tub, but it stores easily in the bathtub, cleans up very easily, and you will be able to use it for 2 years at least!  Well worth the extra $$.",2004,1086220800B000056OV0A2FH9IFBOQTFNP,B000056OV0,A2FH9IFBOQTFNP
286,positive,Awesome!,"My baby was breast fed for the first 2 months. We used a nipple shield by Medela but as she got older the nipple shield was just not cutting it when it came to my baby being full. I decided to pump but when my baby was fussy I couldn't pump every 3-4 hours like I needed to so my supply dropped. I didn't buy this starter set, I bought a few 4 ounce bottles and gave my baby what milk I had pumped and formula. I have now bought the 8 ounce bottles and use them also. These bottles are great. My baby burps right away and is never gassy. With breast feeding she hardly ever burped. We use the drop in liners and have had NO problems with leaks. I also heat her formula up by putting hot water in a cup, putting the formula in a liner and dropping the liner into the warm water. Then I mixed it up with a spoon to make sure there are no cold spots, test it and put the liner into the bottle and feed my baby. You also don't have to worry about water dripping off the liner and getting on baby because of the plastic they are made of, the water does not stick to the liner. When I pull the liner out you can't even tell it has been sitting in water.(...)",2005,1108080000B00008614FA1CGOXRZ1A9PCY,B00008614F,A1CGOXRZ1A9PCY
287,positive,So convenient!,"I originally bought the Munchkin formula dispenser to use while we were out and about. Since then I have found that I even like to use it at home also. It's so convenient to be able to pour the pre-measured amount of formula into my sons bottle. So simple. I also have a formula dispenser that I got at WalMart (Parent's Choice brand), and that one works well also, but doesn't hold the full 8 oz. worth of formula that this one does. The Munchkin formula dispenser was a great buy for sure!",2008,1202083200B0009ET94AA1C80KO0L5I0IZ,B0009ET94A,A1C80KO0L5I0IZ
288,negative,Doesn't mix Nutramigen very well.,"The concept of this pitcher is to keep the mixing blades below the surface of the liquid to keep air to a minimum.  Unfortunately, lots of formulas float and need a lot of agitation to mix properly.  For these formulas, this pitcher is useless.Additionally, the lid goes on secure but is not liquid tight.  Tip it or shake it and you'll have a mess.One last item - in order to adjust the height of the mixing blade you have to take the lid off and push a rubber grommet up/down the shaft.  This isn't easy and of course it's wet with formula.  This seems like a messy or unsanitary way to have to do every time you make and pour a bottle.Instead we found a liquid tight pitcher.  Shake the heck out of it to mix, then a few hours later the bubbles have settled.  If you can plan more than a bottle ahead, this might work out better for you, too.",2008,1203897600B0010L98DIA3EK2KTYHJCPB9,B0010L98DI,A3EK2KTYHJCPB9
289,positive,Cute and Useful!,This cute storage provides a useful place to store all the baby materials from the hospital and doctor's visit.  Lots of extra folders for additional items.,2008,1226188800B001F8TLLUA3752DDGZ3COTF,B001F8TLLU,A3752DDGZ3COTF
290,negative,Look at the back straps! BUY SYNERGY WITH BACK SUPPORT!,"Don't you think those back straps will pull your shoulders forward? YES they will. My back started to hurt after 5 minutes walking with my 9 lbs baby! I give not 1 but 2 stars because it is a good quality, strong, VERY easy to use baby carrier, BUT invest more money in it and buyBabyBj&ouml;rn Baby Carrier Synergy - BlackIt has that magic back support! P.S> You have to adjust the straps as your baby grows then nothing will press against her diaper area or anywhere else.",2009,1236038400B0009JOSNWACRLYXWTJW9GP,B0009JOSNW,ACRLYXWTJW9GP
291,positive,Very Comfortable,This Boppy is very comfortable.  I like the asymmetrical design; it allows me to tuck the larger part between my legs while the smaller part is wedged under my belly for extra support.  I had been having hip pain while sleeping at night and this little jobby did the trick.  The only negative comment I have on this is that it does tend to make me a little warm while sleeping but I think anything would.  All in all this was a great purchase and I would suggest it to anyone trying to adjust to sleeping on their side (I am typically a stomach sleeper) or to anyone experiencing hip pain.UPDATE:  I have now had my baby and have used this pillow to help prop him up during feedings!!!  I have gotten my money's worth out of this Boppy; I use it every day still.,2005,1128988800B00063EDEKA1ZPFA3QQFBBX6,B00063EDEK,A1ZPFA3QQFBBX6
292,positive,Love this!,"No complaints!  Love this carrier.  Only complain, baby outgrew it.  We did get a lot of use out of it though before that.",2004,1099180800B000059XODA2T8KEA8791MQ0,B000059XOD,A2T8KEA8791MQ0
293,positive,2 Month Old Loves It!!!,My daughter loves this gym!  She laughs out loud at the musical star!  All of our videos of her are on this mat.  I like it because everything is detchable and I sometimes take the birdies and attach them to her car seat.  She just loves all of the goodies associated with the mat.  I would say that this item is definately worth the money!,2005,1105315200B0000936LRA2611L97GGZH5,B0000936LR,A2611L97GGZH5
294,positive,Great for messy kids,"My daughter is 20 months old and loves to do it ALL herself...this bib is a lifesaver, and an outfit saver.  The pocket is perfectly placed and the shoulders are wide enough to protect her sleeves.  If only I'd bought this a year ago...",2007,1186358400B000GJF5D2A2B54P9ZDYH167,B000GJF5D2,A2B54P9ZDYH167
295,positive,No Gas Problems,"My son is one big ball of gas. We loved the Advent bottles but they didn't help with his gas problem. These bottles are great for babies who don't need any more air in their tummys. Also the nipples are great for babies that used to the breast, or babies that are between the breast and bottle.The newborn gift set gets you going with all the bottles you will need to start things out plus some for when baby starts getting older.No air in belly, price is not over the top, nipples are the best I have found, and very well made (no leaks at all)",2006,1139011200B00006966IAEK5GOE7UFP2P,B00006966I,AEK5GOE7UFP2P
296,positive,All in One Essentials,This is definitely the set to get. It includes everything you'll need for baby well care in a convenient storage pouch. I tend to leave things all over my house but with this kit I never have to search for tiny items. All of the pieces I've tried so far work very well also. The clippers are my favorite since they are very easy to handle. The scissors work for nails as well. The brush is excellent....very soft bristles for my daughter who doesn't have much hair yet. Nail files and alcohol swabs are nice extras. The bulb syringe works better than the one from  Gerber that I have and the thermometer was a cinch to use as well. I have yet to use the medicine dropper or water temp taker but I doubt there is anything wrong with those items. I also have to wait for my daughter's teeth before I test the toothbrush but it's nice that I have everything handy already. I love this set and keep it clipped on my nursery cart. It also comes with a useful book on taking care of your baby. Definitely the best kit with the most baby essentials.,2002,1036886400B00005UC6DA307YFSORUAXSQ,B00005UC6D,A307YFSORUAXSQ
297,negative,Don't waste time and money on this stroller!,"I bought this stroller when our son was 1 month old and used it not even for 5 months and also occasionally. I found this stroller to be a piece of junk!! The back bends like a letter C and our son who is not even 6 months yet was so uncomfortable that I had to buy another stroller ""Peg Perego Aria"" and am so glad I did because it is much lighter than chicco and much sturdier. Peg Perego also has a bigger basket. In the end, I returned the Chicco, the customer service at BabiesRUs was so great that they gave us a store credit. Beware!!! The chicco stroller at the beginning seems to be great but after a while as the child gets older and heavier, the flimsy back bends!!! Don't waste your time and money on this stroller!!!",2006,1139529600B0009DPILEA12D7ROCUOZVP8,B0009DPILE,A12D7ROCUOZVP8
298,positive,Perfect for newborns,It really makes the newborn baby comfortable and easy to carry without a lot of blankets.,2009,1249344000B001P7YFKIA1VJ16TJBHRRW,B001P7YFKI,A1VJ16TJBHRRW
299,positive,nice lil unit,this is a good pump. it just has a bit of a learning curve. i can successfully pump 2-4oz in 10-15 min with this pump. it's also quite quiet.highly recommended.,2009,1256601600B001FSHJFUA3DEISWZD80JCK,B001FSHJFU,A3DEISWZD80JCK
300,positive,Get the colored ones,I've tried a few different brands of pacifiers and these were hands down the best. I tried the NUK type and they kept flying out of my baby's mouth. She has done well with these since birth (she is now 9 months). She had some of the clear pacifiers and they were so hard to find if they fell or got misplaced. Try the colored ones. I highly recommend them!,2008,1205798400B000EGZ2SAA36N62I47U9IIH,B000EGZ2SA,A36N62I47U9IIH
301,positive,BEST PUMP EVER!!!,"I used an avent pump with my first and let me tell you how great this pump is. All you do is attach the liner to the breast pump, fill it up, and cap it and you can store it or feed right then. It is so comfortable. You have 5 settings to choose from for the speed and suction. It comes with bags for everything. The carrying case, case for traveling with milk and bottles, and case for the parts. LOVE IT!! It cannot get any easier than this. I pump 4 ounces in less than 3 minutes. Try this and you will love it",2006,1146355200B0000TYHD2A38DSZM1N0WDQ0,B0000TYHD2,A38DSZM1N0WDQ0
302,positive,love it!!,This is the best thing ever. My daughter was in a booster seat before we got this but she wanted to feel like a big girl and sit at the table. Just pushing her booster up to the table wasn't good enough. The kaboost did the job. It's very sturdy and easy to put on the chairs. plus you can take it to restaurants without it being a pain. I highly recommend it to everyone with a toddler.,2008,1220832000B000V3YFJIA36BTPMVB6B84K,B000V3YFJI,A36BTPMVB6B84K
303,positive,Great safe place to play,"I got this with the extension.  It's been great for my twins.  There is lots of room for them to play with each other.  It also offers me a safe place to put them if I need to do something quick like pour a bottle.  It did take some maneuvering to set up because it is large and awkward when you unfold it.  It also sounds like you're breaking it because it has ""teeth"" on each hinge that pop into place in small increments (each increment makes a clicking sound).  We don't bother to open or close the gate to get in and out, we just step over it.  It is sturdy enough that my daughter, who weighs 22lbs now, can pull herself up on it.",2009,1243209600B00020L78MA20H94SV8OUQRN,B00020L78M,A20H94SV8OUQRN
304,positive,Love Gerber the best,I think Gerber has the best skin care line.  My son had excema when he was an infant and the Gerber is the most moisturizing for his skin.  This is a great gift set which includes all their great scents.  I would highly recommend this over Baby Magic and Playtex anyday.,2005,1135728000B000095S69A1SHLMPWR0FOVT,B000095S69,A1SHLMPWR0FOVT
305,positive,Super soft boppy,"I love the boppy, when my back hurts it's the perfect way to nurse, baby loves to play on boppy!",2006,1140998400B000069RAOA15U5ZSFC0Q0EJ,B000069RAO,A15U5ZSFC0Q0EJ
