,polarity,summary,reviewText,year,uuid,asin,reviewerID
344,positive,This monitor is amazing!,"We just set up our son's nursery and tested out the Sony monitor. I sat in the nursery opposite side of the room from the monitor and whispered as quietly as I could as my husband walked all over our house. He could hear me everywhere he went, both upstairs and down.We were a little concerned with finding a monitor that would work for us, because we live in an old Victorian house with plaster walls. To use cell phones in our house, you have to stand by a window and not move or you will lose your call. The Sony 27 channel monitor worked perfectly! We couldn't ask for anything more!",2005,1121990400B000S35QLCA1XTRCXQYYHMMM,B000S35QLC,A1XTRCXQYYHMMM
345,positive,Buy this tub!!,"I was reluctant to register for this tub because it was so affordable.  But it is GREAT! I don't know what I would've done without it because it comes with a net to place newborns in...and their heads are so wobbily, you really can't do without it.",2006,1139011200B000067EH7A2PGJ6XD5T5300,B000067EH7,A2PGJ6XD5T5300
346,positive,my daughter is mesmerized,"I will lay her down and she will go through all three fifteen minutes settings, only fussing if we take to long to start it over.  I wish the one I purchased had a remote, and I also wish that it worked with an adapter, because the battery gets used up real fast.  Overall, very very happy with this product... that's both me and my daughter",2005,1122595200B00006G963A2HHX876PGDZL,B00006G963,A2HHX876PGDZL
347,positive,Inexpensive Cups with Straws,"I had been using the Take and Toss ones in the sippy cups and saw these with the straws. It's one step closer to moving my son to using regular cups. He feels like a big boy using a cup and straw instead of a sippy cup like his baby brother.They last with repeated use for several months then ours eventually develop a crack in them from being thrown on the floor. I do hand wash mine even though they state top-rack dishwasher safe and I believe that helps them last a little longer.  My sons are at the age where we are transitioning them from sippy cups to regular cups and these are perfect for that in-between stage.These are also labeled plastic type 5 which is polypropylene which is considered safe and does not leach BPA (bisphenol-A) into foods and beverages like some plastics can. That makes me feel better and sets my mind at ease about using these with my children.Make sure that you put the lid on the cup and then insert the straw. If you are refilling and take the top off with the straw still in and then replace, liquid will come shooting out the straw.",2008,1218067200B0000BX8LVALNFHVS3SC4FV,B0000BX8LV,ALNFHVS3SC4FV
348,positive,Great Pump with a Great Price,"I have loved this pump.  I have used it since I got home from the hospital and my daughter is now 10 weeks old.  The only other pump I have experience with is the Medela Symphony in the hospital.  I found the 3 minute letdown feature annoying on it.  The Hygeia Enjoye jumps right in just like the baby and works well.  It pumped better for me than the Symphony did in the hospital.  I have never had any complications with it and use it daily, sometimes multiple times.  I understand the reason for the baby recording button, however, I find it silly and annoying since I seem to hit it by accident.  I have not had issues with pumping so it may be useful if you do.  I would recommend this pump to anyone and love that it is more green and can safely be reused by others.  Nothing has broke or worn out.  I could think of a few improvements like the ability to pump into storage bags, etc, however, for the price and quality I give it 5 bright stars.",2009,1256169600B0028MI4M4A2MQ7X9MMX3XQZ,B0028MI4M4,A2MQ7X9MMX3XQZ
349,positive,Worth the cost!!!,"These bottles are a true must have!  They are the only worthwhile bottles on the market and are well worth the extra price as well as the extra time to wash.  They really limit the gas intake and we never had an issue with leaking bottles, like so many other brands.  It is a bit of a hassle to get all the pieces in the dishwasher.  I like the wide neck bottles because they are closer to breast feeding and when my son got older, it was easier for him to hold the bottle on his own.",2008,1201651200B0000936M4A2LYF3DJN9X5JN,B0000936M4,A2LYF3DJN9X5JN
350,positive,"Loud, but good","This pump is very good.  I had to pump while my daughter was in the hospital the first month of her life.  During the day I used the hospital grade pumps at the hospital, but at night I used this pump until finally buying the double electric Medela pump. I got just as much milk with this pump as I did the hospital pump.  I only used the electric plug, never batteries.  It is a handy pump to have.  I don't see how a nursing mom can go without ever having to pump at some point, even if its for cereal when they start that. Medela is definitely the best pump to get, and don't even think about a manual one.  I never pump now since I'm home with my baby, but I am so glad I have this pump. It is definitely loud, but putting a folded towel over it helps.  If you have to pump a lot, and can afford it, a double pump is the way to go though...it takes half the time, which is very important when you have a baby to take care of.",2004,1086912000B000056HMVA3Q0XNQUB1EILY,B000056HMV,A3Q0XNQUB1EILY
351,positive,Baby's Personal Disney Ride!,"This swing is the best! There is so much fun going on, it's like our baby has her own personal Disney ride at home! The music is great & she loves to stare at the fish & lights in the water filled globe. The seat is plush & comfortable with a colorful fish pattern. Seat cover washes nicely. She even falls asleep in it sometimes. It was pretty easy to put together-just follow the directions.",2005,1123632000B0006FHFYSABTVDDH7CDA0B,B0006FHFYS,ABTVDDH7CDA0B
352,negative,We just didn't use it,"We tried to install his under our car seat, but it didn't fit easily under the seat base in our small car, and seemed to make installation more difficult.  Rather than risk it, we haven't used it.",2003,1066003200B000083GHYA3PP8U6JJEAYT6,B000083GHY,A3PP8U6JJEAYT6
353,positive,Very durable and sturdy,"This is very heavy so that it cannot be lifted by any young child. My 8 year old cannot lift it.  But it can slide a little if your child puts their weight on it. It will not topple over as this is impossible. I use it to block my garage so that my 2 year old doesn't run out of the garage and into the street. Once your child is too big to fit in a playpen, you can get this so that they have more room to play, but still have them contained.It is very difficult during the first few times you open and close it. But it does loosen up and becomes easy enough to setup alone. It is actually better that the joints don't move so easily so that your child cannot change the shape of the play yard when they push against it.",2009,1248825600B00020L78MA5CDMTW6JKV5G,B00020L78M,A5CDMTW6JKV5G
354,positive,Easiest way to bathe a baby!,"The safer bather is the BEST baby bath aid out there! It's soft but not squishy, contoured so baby dosn't roll off, small and easy to store, machine washable, and babies love it! What else could you ask for? I don't know how anyone could choose one of those big, clunky tubs over this.***UPDATE***Almost 3 years, two kids and many baths later this safer bather is still getting used and works just like it did when it was new!",2006,1144108800B00005JIVIAFG4HIHMX312C,B00005JIVI,AFG4HIHMX312C
355,positive,A must,My son would not take naps in his crib but would nap for hours in this swing.  The soothing music and sounds are very pleasant and my son likes to look at himself in the mirrored part.,2005,1115942400B0001IU5HYA3UFQ6AD7I3APQ,B0001IU5HY,A3UFQ6AD7I3APQ
356,positive,So many uses!,"My son is four months and this product is perfect.  No smells at all!  Holds a decent amount of diapers, my husband empties it once a week.  No down side, all pluses here!  Especially no special bags to buy.  And when your child is out of diapers, you can use it as a regular trash can to put food or pet waste in.",2006,1139443200B00003TL7PA2VX8J2HVPUIOE,B00003TL7P,A2VX8J2HVPUIOE
357,positive,Works great,I switched to these from Avent with no problems.  So far I like these better.  My son didn't want to switch to the Stage 3 until he was almost 8 months old - so I'd try them out before I plunged.,2008,1208563200B000MRGMSAA1IBKN1GXYJ3K4,B000MRGMSA,A1IBKN1GXYJ3K4
358,positive,"Fun product, but not all colors are ""worthy"".","My husband and I bought this for our little girl's nursery. It's perfect; however, the amber lights are barely visible - even when the room is completely dark. Furthermore, the blue lights are not that great (although better than the amber ones). The best are the green stars. They are the most clear and most visible. Overall, we are very pleased with this product and would recommend it to others. Enjoy!",2008,1216080000B000BNQC58AS7ZRG5D5XACX,B000BNQC58,AS7ZRG5D5XACX
359,positive,My triplets love it!,"My trio loved this thing and still will play with it, lol. Each section is a squeaky, crinkle or rattle, and the mouth squeezes to play music. If you wash it, the music stops playing though, lol.",2009,1231286400B000I2MRJCATK1RL71E7AHC,B000I2MRJC,ATK1RL71E7AHC
360,positive,nice,"I like to use reusable washable nursing pads at home, since they are softer than disposables & more comfortable. Like other reusable pads, I won't wear them away from home because they could leak through, and they are more bulky and so can be seen through my clothing.  These are soft and I prefer the jersey version of these pads (the fleece version tended to leave lint on my skin if it wasn't completely dry--yuck for baby!).",2009,1246147200B001NAAQP0A32ES0MXME1TX3,B001NAAQP0,A32ES0MXME1TX3
361,positive,The main dish is all I use,I do not use the individual smaller containers that came with it.  They don't seem that useful to me.  But the main dish I like this because it is very useful to keep veggies and fruits separate when feeding my baby.  It is a decent size.,2008,1201046400B000BH79VKA14UOOROH3XRQ9,B000BH79VK,A14UOOROH3XRQ9
362,positive,Perfect!,These buckets are better and safer than a toy chest!  The different sizes allow allow us to organize some if we choose or grab one to take on a trip.  My daughter loves playing with them and it is easy for her to take her toys in and out.  I haven't had to worry about safety with them either as they collapse easily.,2008,1214438400B000XPB6UUA2TG259EXI9PJ0,B000XPB6UU,A2TG259EXI9PJ0
363,positive,This is a great invention!,"I love our wipe warmer!  I've also seen some of the negative feedback, and I don't have of those problems at all!  If you follow the directions with the package, your wipe warmer will be fine!  The Ever-Fresh pad at the bottom does dry out, but we just re-wet it each time we replace the wipes.  I've never had any wipes get brown or dried out.  The wipes stay warm long enough for me to use them - I just make sure to pull out a wipe as I need it.  And yes, some wipes are not made for the top part that allows another wipe to pull out after.  But all you need to do is buy the wipes that are folded that way.  I buy the Especially for Baby wipes in the big box.  You can get them at any Babies R Us or Toys R Us.  It costs about $10, and lasts us for over a month.  Plus, they're nice and soft and have no scent.The ONLY complaint I might have about the wipe warmer is that when I pull out a wipe, another wipe usually comes out with it unless I use 2 hands to pull.  But this is a minor issue.  I'd much prefer to have the wipe warmer.  This isn't a necessary item, but it's definitely something worthwhile to have!",2005,1130112000B00008ODBGA1WUPF0L9YH9JL,B00008ODBG,A1WUPF0L9YH9JL
364,positive,Wish FP would please with toddler toys as much as baby...,"Ok, I have to say that since I became a mom 3 yrs. ago, I have LOVED FP toys! And this bouncy seat/rocker has been one of my favorites! I gave it up recently when my 1 1/2 yr. old was tired of it after using it with my now 3 yr. old AND I just have to say  that it was a life-saver sometimes! I wish all their stuff was this good! You'll have to read more of my reviews about OTHER toys to see what disappointed me....This bouncy/toddler rocker is a good buy! You won't regret it!",2009,1235088000B0002ZOI9WA2JW331ATA1PP2,B0002ZOI9W,A2JW331ATA1PP2
365,positive,Doesn't Require Batteries!!,"As a first-time mom to a now 6 month old boy, I have run the gamut in terms of baby toys.  This is one of the best I have come across so far.  It's durable and educational.  I love that it doesn't matter what end you set it on.  There is no upside-down to this toy.  My son can pick it up and move it around with one hand, so it isn't too heavy, which is definitely a bonus.  He likes hearing the sand/rattle sound when I turn it over for him.  He likes to spin the little pieces and/or watch me spin them.  There is so much to see and do with this toy, and I love that the creators of it didn't feel the need to design it with all kinds of flashing lights, silly songs, and other bells and whistles.  If you want a good, basic, entertaining, educational (and I might even venture old-fashioned in some ways) toy, you should definitely get this one.  My son has to actually do something with this toy rather than listen to it and watch some lights flash.  I'm a little tired of all the toys that I've come across that don't really do anything except drain batteries.  I like the more classic purpose behind this toy.",2008,1215129600B0002Q2OPGARQBZYLCWEOFU,B0002Q2OPG,ARQBZYLCWEOFU
366,negative,Didn't fit on anything we owned,"I received this as a gift, unforutnately it didn't fit on our stroller (pretty standard Graco Travel System) or on our carseat (either our Grace or our Marathon) and so it was pretty useless.",2004,1082592000B00003TL3HA2WNXS3CNAQS01,B00003TL3H,A2WNXS3CNAQS01
367,positive,"Easy to add, and very secure","I was worried that the extension would be loose, or threaten the integrity and safety of the gate itself. But it isn't, and doesn't, and took literally seconds to snap onto the gate. Yahoo!",2004,1091491200B00005N9X8A1LX9GSMN66L7E,B00005N9X8,A1LX9GSMN66L7E
368,positive,Solution to feeding my baby,"I had trouble getting my breastfed baby to take an Avent bottle (which my first took beautifully) so I called the lactation consultants at the hospital to ask their advice.  They suggested the Evenflo classic bottles which are like these except plastic with the clear nipple.  They worked great.  After swearing by Avent with my first, I never imagined the solution to feeding my second would be an ""old-fashioned"" type bottle.  It works though so I will stick with them.",2005,1116374400B000056W4VA1P708DJ39TQ4W,B000056W4V,A1P708DJ39TQ4W
369,positive,Doesn't leak!  Love this cup,My little girl loves trying to use this cup.  I say trying because she is breastfed and hasn't even learned to use a bottle yet.  She loves the colors and likes to see the liquid inside this cup.  The handles are perfect for her little hands to grab and the sippy nipple is soft enough for her to use.  She is still learning but this product is so great we might skip bottles all together and graduate to these after the breast!!,2009,1256688000B001QXCF12A1F0809QT61J2D,B001QXCF12,A1F0809QT61J2D
370,positive,Great diaper pail!,"I've had this diaper pail for 3 years now, and it's been through 2 kids (both in diapers for 18 months of that!).  I love this diaper pail! My favorite feature is that it doesn't require special refills--it can use any trash bag (we just use a tall kitchen trash bag).  My 3 1/2 year old still hasn't figured out how to open it, but it's easy enough for me to open quickly.  The only times I have had a problem with odors is if too many diapers are stuffed into the pail.  Even then, these odors can be minimized with a bit of baking soda sprinkled in the bottom of the pail.Although I debate the necessity of ANY diaper pail, this one receives 5 stars from me!",2004,1088035200B00003TL7PA2XUQN9HUD6ISG,B00003TL7P,A2XUQN9HUD6ISG
371,positive,Almost perfect,"I like this wrap a lot and I am really into baby-wearing.  The fabric is really soft and it comes in so many nice colors.  My daughter loves it, too.  My only problem is that it's a little complicated.  It's not easy enough to get it on and off.  And when my baby wakes up and wants to be fed, I'd really like to be able to get us out of the wrap faster (sometimes I am able to just shift her around and feed her in the wrap).  My only other issue is that it's very warm - and I live in a hot climate.  She can't wear it for too long without getting overheated and fussy.  I don't think this will be as big of a problem next summer, though, when I can use .  I've started using the maya wrap more, because it's easier and cooler, but it's not as versatile.  If I had to choose between them I'd choose the moby.",2009,1253318400B000N9H4SEA1YHI49AWYNI34,B000N9H4SE,A1YHI49AWYNI34
372,positive,awesome,"Love this stroller.  It is a breeze to assemble, light, easy to carry.  It folds compactly with one hand (wonders when you're holding a chunky squirmer), turns on a dime, and the handles are comfortable for extended walks.  The front wheels can be locked for pushing over grass or other rougher surfaces, and surprisingly it works really well.  My 6 month old rides in it with no trouble, and it will easily accomodate her growing little body for well over a year.  The seat is cushioned, the ride is smooth.  Two drawbacks - the sunshade doesn't extend out very far, offering limited protection at best.  It also attaches kind of funky - you have to fold back the fabric on the side bars and snap it over a little button, which doesn't hold it securely at all.  I overcame this by purchasing a rayshade by kiddtopomus for $11.  The other minor drawback is that the seat does not come up all the way.  It lets down smoothly for sleeping, but baby has to sit slightly reclined when it is pulled up as far as it will go.  My girl doesn't seem to mind this at all, but other babies might.  I don't have a problem with the small storage area underneath, or the lack of cup-holders.  If you're not struggling with juggling a baby AND a bag, it is pretty easy to push a stroller and sip on drink.",2009,1240531200B000UEDH42A2G5YYK19RH1X8,B000UEDH42,A2G5YYK19RH1X8
373,positive,a very beautiful toy,"I like this mobile, the leaves moving up and down, the animals slowly moving around. this is lovely, with soft music for baby, and even a little night light. This is a gorgeous exotic looking mobile. It is pleasant to look at and always catches my sons eye.This does run on big batteries, not included. It requires some assembly. I was able to put it together :) must have a philps screwdriver.The music is ok, but none of the music is listed under the correct composer, that isn't a serious problem at all, but something worth noting. Mozart plays bach, Bach plays Beethoven, Beethoven plays Mozart. This is a good quality product, just what I wanted, and I think i love it more than my son does.",2007,1181347200B000JIHP88AN4KFKJ1D4JOX,B000JIHP88,AN4KFKJ1D4JOX
374,positive,the best jumeroo/exersaucer available!,My daughter is six months old and absolutely LOVES this jumperoo. It has enough to keep her interested for as long as I let her sit in it. She loves the music so dances and jumps up and down. We dno't know what we'd do without this!,2009,1258675200B001GQ2RZIAI2PLMLUMTCHL,B001GQ2RZI,AI2PLMLUMTCHL
375,positive,Quality compact rack,"This is a quality rack that holds a lot, fits in a small space, and rotates for easy access.  I can see that it probably wouldn't support glass bottles, but for everything else it's great.",2009,1257120000B000K53UEIA9PJRH1EHROYC,B000K53UEI,A9PJRH1EHROYC
376,positive,Great Space Saver,"We use this to organize creams, wipes and diapers on the changing table.  It keeps the area clear or clutter and we use it every couple of hours, so I can't complain.  If I could change one thing I would want it to hold a few more diapers.  I would recommend this to a friend and would purchase it again.",2009,1231718400B00006408KAF7FMQKDMSNXN,B00006408K,AF7FMQKDMSNXN
377,positive,An essential!,I bought this for our infant son after reading the glowing reviews on this site.  People are right!  This is a must-have!  We've used this for about four months now and it makes bathing our baby so simple.  It holds him comfortably and I never end up with back strain.  The Safer Bather also dries very easily.  A great product!,2003,1056412800B00005JIVIAZM5AKLRCPOJX,B00005JIVI,AZM5AKLRCPOJX
378,positive,Quick and easy,"This is THE best way to sterilize bottles, bottle pieces, pacifiers, and breastpump parts.  It is quick and easy.  Forget boiling water or whatever else, get the microwave sterilizer.",2002,1010880000B000056OUHA3DC7Y9HO0C457,B000056OUH,A3DC7Y9HO0C457
379,positive,great sippy!,"This sippy is great! My 9 month old son has no problems holding it or sucking out of it. I had no issues taking the spout off as it has a small ""lip"" to pry with your fingers. It does drip slightly when held upside down, but what sippy doesn't? We LOVE this sippy and recommend highly! The only issue we see with it is cleaning, it's a very unique shape and you've gotta wiggle that bottle brush in there to get the bottom middle part.",2008,1219017600B000WEFYDCA36V3SNW7TPKR9,B000WEFYDC,A36V3SNW7TPKR9
380,positive,"If your looking for a great burp cloth, look no further!","After searching online and in many retail stores at malls, Target, Babies and Toys 'R Us and Walmart, I was only finding these gauze type ""cloth diapers"".  I was appalled that these were considered soft enough or absorbent at all to be put close to my baby!So, after no success, I came on to Amazon and found the many incredible reviews of this product using them as burp cloths.  I decided to order one package and when they arrived I was thrilled at how soft they were and looked forward to using them with my new baby.  They absorb a great amount of formula since my son is quite a dribbler and they wash wondefully.  In fact, I think they have even gotten softer.  We were so happy with this product that we purchased another package within the first few days that we used them.So, if you are looking to use them the way we did and find that the gauze type found in most stores to be unacceptable, then get these!!!  You won't regret it!",2005,1116806400B0000649E5A3AIIBXOIZ3J2O,B0000649E5,A3AIIBXOIZ3J2O
381,positive,Great entertainer!,"I bought these for my son for his infant carrier. He loves them! Whenever we are out and he gets upset, I pull or swing the bugs and he stops. Unfortunately he'll be in a regular seat soon and I don't think I'll be able to use them anymore. Also I wish the 'vibrating' bug went up slower. Other than that great toy!!! Also a great price!!!",2005,1112486400B000058DNEAIJ3JAT8596TA,B000058DNE,AIJ3JAT8596TA
382,positive,Parents life saver,"When we fostered our first child  a friend let us use a very similar one from One step ahead. We made it huge by not closing the ends together but make a semi circle wall against a wall outlet free wall and she had the best time in her area I never had to worry about her safety as I went about my daily chores, she even took naps in it. She cried when I took her out of it. And she enjoyed it outside as well. We had to give that one back and when our new baby was born we bought this and have road tested it with my 16 month old nephew he loves it as well and his parents are buying it for him and his new brother on the way. I would say of all of our baby gear purchases this was the best!!!!",2005,1133308800B008CMQTZIA26AGFVWTXKZIC,B008CMQTZI,A26AGFVWTXKZIC
383,positive,Loved this gift!,"We received this gift for our son and have used it since he was born. He is 21 months old and still loves looking at the stars. He will point to the ceiling and say ""stars."" He loves pressing the buttons to change the colors on the ceiling. We have no problem seeing the amber color on his ceiling. We are going to buy the sea turtle one for our baby on the way. It will be nice to have the both since we are turtle fans! I think this gift along with the sleep sheep by the same company are wonderful!",2009,1261699200B000BNQC58AX4U144YCMLV4,B000BNQC58,AX4U144YCMLV4
384,positive,Best bottle system. Period.,I understand that some people might have a problem with this bottle type. If you screw the top on crooked at all or too tightly - you may have issues. But if you take a second and make sure that you are screwing on the top properly - you might have a leaking bottle once every 30 or 40 tries. I have used 4 of the other top brands and am very pleased with Avent. The Brownies are really good too - but just too hard to clean on a regular basis. If you only use a bottle once in a while - use browns - but if you use them a lot - get Avent. Only way to go.,2007,1187395200B000056HNXA226VGZWOEBPGL,B000056HNX,A226VGZWOEBPGL
385,positive,Good for grabbing,"I like this toy because my almost 6-month old son can easily grab and hold on to it.  However, he's at the stage where he wants to put everything in his mouth, and he tends to get frustrated becaues this doesn't really lend itself to being chewed on.  I think he'll like it more when he can play with it like a ball, rather than trying to use it as a teether.",2009,1253664000B001UF8BL4A3VWTB09FI0MCQ,B001UF8BL4,A3VWTB09FI0MCQ
